{
  "$schema": "../resources/schemas/workflow-config.schema.json",
  "schemaVersion": 1,
  "activeProfile": "workflow:resources/profiles/default/profile.json",
  "plugins": [],
  "paths": {
    "knowledgeRoot": "tests/fixtures/knowledge",
    "skillsRoot": "tests/fixtures/skills",
    "tasksRoot": ".agent-workflow/tasks/local",
    "runtimeRoot": ".agent-workflow/runtime"
  }
}
